{
  "$schema": "../../schemas/pay-da-history.schema.json",
  "version": "1.0.0",
  "generatedAt": "2026-08-28",
  "disclaimer": {
    "en": "Reference only; verify with the official gazette/order or your DDO.",
    "hi": "केवल संदर्भ हेतु; आधिकारिक राजपत्र/आदेश अथवा अपने डीडीओ से पुष्टि करें।"
  },
  "base": {
    "cpc": 7,
    "from": "2016-01-01",
    "index": 261.4,
    "linkingFactor": 2.88,
    "note": {
      "en": "The 7th CPC pay matrix subsumed the Dearness Allowance payable on 01.01.2016, so DA restarted at nil on that date. 261.4 is the 12-month average of the AICPI-IW (2001=100) ending December 2015; 2.88 is the factor that links the 2016=100 series the Labour Bureau now publishes back to that base.",
      "hi": "7वें केंद्रीय वेतन आयोग के वेतन मैट्रिक्स में 01.01.2016 को देय महँगाई भत्ता समाहित कर लिया गया था, इसलिए उस तिथि से महँगाई भत्ता शून्य से पुनः आरंभ हुआ। 261.4 दिसंबर 2015 को समाप्त होने वाले 12 माह का अखिल भारतीय उपभोक्ता मूल्य सूचकांक (औद्योगिक श्रमिक, 2001=100) का औसत है; 2.88 वह गुणक है जो श्रम ब्यूरो द्वारा अब प्रकाशित 2016=100 श्रृंखला को उसी आधार से जोड़ता है।"
    }
  },
  "formula": {
    "expression": "DA% = ((12-month average of AICPI-IW(2016=100) x 2.88) - 261.4) / 261.4 x 100",
    "description": {
      "en": "Dearness Allowance is revised twice a year, from 1 January and 1 July, on the 12-month average of the All India Consumer Price Index for Industrial Workers ending the previous December and June respectively. The Government notifies the rate in whole per cent.",
      "hi": "महँगाई भत्ते का पुनरीक्षण वर्ष में दो बार, 1 जनवरी और 1 जुलाई से, क्रमशः पिछले दिसंबर और जून को समाप्त होने वाले 12 माह के अखिल भारतीय उपभोक्ता मूल्य सूचकांक (औद्योगिक श्रमिक) के औसत पर किया जाता है। सरकार दर को पूर्ण प्रतिशत में अधिसूचित करती है।"
    },
    "source": {
      "name": "Report of the Seventh Central Pay Commission, Chapter 8.17 (Dearness Allowance)",
      "url": "https://doe.gov.in/files/cenetral-pay_document/7cpc_report_eng.pdf",
      "dated": "2015-11-19"
    }
  },
  "rates": [
    {
      "effectiveFrom": "2016-01-01",
      "rate": 0,
      "status": "notified",
      "note": {
        "en": "The base date of the 7th CPC pay structure. Dearness Allowance as on 01.01.2016 was merged into the revised pay, so no DA was payable on the revised basic pay from this date.",
        "hi": "7वें केंद्रीय वेतन आयोग की वेतन संरचना की आधार तिथि। 01.01.2016 को देय महँगाई भत्ता संशोधित वेतन में मिला दिया गया, अतः इस तिथि से संशोधित मूल वेतन पर कोई महँगाई भत्ता देय नहीं था।"
      },
      "source": {
        "name": "CCS (Revised Pay) Rules, 2016",
        "url": "https://thc.nic.in/Central%20Governmental%20Rules/Central%20Civil%20Services%20(Revised%20Pay)%20Rules,%202016.pdf",
        "reference": "G.S.R. 721(E)",
        "dated": "2016-07-25"
      },
      "fetchedAt": "2026-08-28T00:00:00Z",
      "verify": false
    },
    {
      "effectiveFrom": "2016-07-01",
      "rate": 2,
      "status": "notified",
      "note": null,
      "source": {
        "name": "Department of Expenditure, Ministry of Finance — Dearness Allowance orders (7th CPC)",
        "url": "https://doe.gov.in/order-central-pay-commission/16",
        "reference": "O.M. No. 1/3/2008-E.II(B)",
        "dated": "2016-11-04",
        "note": {
          "en": "The Department of Expenditure keeps only the current Dearness Allowance order at a fixed path and does not archive superseded ones, so the order reference here has not been re-read from its own PDF.",
          "hi": "व्यय विभाग एक निश्चित पथ पर केवल वर्तमान महँगाई भत्ता आदेश रखता है और अधिक्रमित आदेशों को संग्रहीत नहीं करता, अतः यहाँ दिया गया आदेश संदर्भ उसकी अपनी पीडीएफ़ से पुनः नहीं पढ़ा गया है।"
        }
      },
      "fetchedAt": "2026-08-28T00:00:00Z",
      "verify": true
    },
    {
      "effectiveFrom": "2017-01-01",
      "rate": 4,
      "status": "notified",
      "note": null,
      "source": {
        "name": "Department of Expenditure, Ministry of Finance — Dearness Allowance orders (7th CPC)",
        "url": "https://doe.gov.in/order-central-pay-commission/16",
        "reference": "O.M. No. 1/3/2017-E.II(B)",
        "dated": "2017-03-30",
        "note": {
          "en": "Order reference not re-read from its own PDF; the Department of Expenditure does not archive superseded Dearness Allowance orders.",
          "hi": "आदेश संदर्भ उसकी अपनी पीडीएफ़ से पुनः नहीं पढ़ा गया; व्यय विभाग अधिक्रमित महँगाई भत्ता आदेशों को संग्रहीत नहीं करता।"
        }
      },
      "fetchedAt": "2026-08-28T00:00:00Z",
      "verify": true
    },
    {
      "effectiveFrom": "2017-07-01",
      "rate": 5,
      "status": "notified",
      "note": null,
      "source": {
        "name": "Department of Expenditure, Ministry of Finance — Dearness Allowance orders (7th CPC)",
        "url": "https://doe.gov.in/order-central-pay-commission/16",
        "reference": "O.M. No. 1/9/2017-E.II(B)",
        "dated": "2017-09-20",
        "note": {
          "en": "Order reference not re-read from its own PDF; the Department of Expenditure does not archive superseded Dearness Allowance orders.",
          "hi": "आदेश संदर्भ उसकी अपनी पीडीएफ़ से पुनः नहीं पढ़ा गया; व्यय विभाग अधिक्रमित महँगाई भत्ता आदेशों को संग्रहीत नहीं करता।"
        }
      },
      "fetchedAt": "2026-08-28T00:00:00Z",
      "verify": true
    },
    {
      "effectiveFrom": "2018-01-01",
      "rate": 7,
      "status": "notified",
      "note": null,
      "source": {
        "name": "Department of Expenditure, Ministry of Finance — Dearness Allowance orders (7th CPC)",
        "url": "https://doe.gov.in/order-central-pay-commission/16",
        "reference": "O.M. No. 1/1/2018-E.II(B)",
        "dated": "2018-03-15",
        "note": {
          "en": "Order reference not re-read from its own PDF; the Department of Expenditure does not archive superseded Dearness Allowance orders.",
          "hi": "आदेश संदर्भ उसकी अपनी पीडीएफ़ से पुनः नहीं पढ़ा गया; व्यय विभाग अधिक्रमित महँगाई भत्ता आदेशों को संग्रहीत नहीं करता।"
        }
      },
      "fetchedAt": "2026-08-28T00:00:00Z",
      "verify": true
    },
    {
      "effectiveFrom": "2018-07-01",
      "rate": 9,
      "status": "notified",
      "note": null,
      "source": {
        "name": "Department of Expenditure, Ministry of Finance — Dearness Allowance orders (7th CPC)",
        "url": "https://doe.gov.in/order-central-pay-commission/16",
        "reference": "O.M. No. 1/2/2018-E.II(B)",
        "dated": "2018-09-07",
        "note": {
          "en": "Order reference not re-read from its own PDF; the Department of Expenditure does not archive superseded Dearness Allowance orders.",
          "hi": "आदेश संदर्भ उसकी अपनी पीडीएफ़ से पुनः नहीं पढ़ा गया; व्यय विभाग अधिक्रमित महँगाई भत्ता आदेशों को संग्रहीत नहीं करता।"
        }
      },
      "fetchedAt": "2026-08-28T00:00:00Z",
      "verify": true
    },
    {
      "effectiveFrom": "2019-01-01",
      "rate": 12,
      "status": "notified",
      "note": null,
      "source": {
        "name": "Department of Expenditure, Ministry of Finance — Dearness Allowance orders (7th CPC)",
        "url": "https://doe.gov.in/order-central-pay-commission/16",
        "reference": "O.M. No. 1/1/2019-E.II(B)",
        "dated": "2019-03-01",
        "note": {
          "en": "Order reference not re-read from its own PDF; the Department of Expenditure does not archive superseded Dearness Allowance orders.",
          "hi": "आदेश संदर्भ उसकी अपनी पीडीएफ़ से पुनः नहीं पढ़ा गया; व्यय विभाग अधिक्रमित महँगाई भत्ता आदेशों को संग्रहीत नहीं करता।"
        }
      },
      "fetchedAt": "2026-08-28T00:00:00Z",
      "verify": true
    },
    {
      "effectiveFrom": "2019-07-01",
      "rate": 17,
      "status": "notified",
      "note": {
        "en": "The last rate paid before the freeze. It stayed in force until 30.06.2021.",
        "hi": "रोक से पूर्व भुगतान की गई अंतिम दर। यह 30.06.2021 तक प्रभावी रही।"
      },
      "source": {
        "name": "Department of Expenditure, Ministry of Finance — Dearness Allowance orders (7th CPC)",
        "url": "https://doe.gov.in/order-central-pay-commission/16",
        "reference": "O.M. No. 1/3/2019-E.II(B)",
        "dated": "2019-10-14",
        "note": {
          "en": "Order reference not re-read from its own PDF; the Department of Expenditure does not archive superseded Dearness Allowance orders.",
          "hi": "आदेश संदर्भ उसकी अपनी पीडीएफ़ से पुनः नहीं पढ़ा गया; व्यय विभाग अधिक्रमित महँगाई भत्ता आदेशों को संग्रहीत नहीं करता।"
        }
      },
      "fetchedAt": "2026-08-28T00:00:00Z",
      "verify": true
    },
    {
      "effectiveFrom": "2020-01-01",
      "rate": 21,
      "status": "frozen",
      "supersededBy": "2021-07-01",
      "note": {
        "en": "Announced but not paid. Three instalments — 01.01.2020, 01.07.2020 and 01.01.2021 — were frozen during the COVID-19 pandemic and no arrears were paid for the frozen period. Do not use this rate for any period.",
        "hi": "घोषित किंतु भुगतान नहीं। कोविड-19 महामारी के दौरान तीन किस्तें — 01.01.2020, 01.07.2020 तथा 01.01.2021 — रोक दी गई थीं और रोक अवधि का कोई बकाया नहीं दिया गया। इस दर का किसी भी अवधि के लिए उपयोग न करें।"
      },
      "source": {
        "name": "Department of Expenditure, Ministry of Finance — freezing of Dearness Allowance",
        "url": "https://doe.gov.in/order-central-pay-commission/16",
        "reference": "O.M. No. 1/1/2020-E.II(B)",
        "dated": "2020-04-23",
        "note": {
          "en": "Order reference not re-read from its own PDF; the Department of Expenditure does not archive superseded Dearness Allowance orders.",
          "hi": "आदेश संदर्भ उसकी अपनी पीडीएफ़ से पुनः नहीं पढ़ा गया; व्यय विभाग अधिक्रमित महँगाई भत्ता आदेशों को संग्रहीत नहीं करता।"
        }
      },
      "fetchedAt": "2026-08-28T00:00:00Z",
      "verify": true
    },
    {
      "effectiveFrom": "2020-07-01",
      "rate": 24,
      "status": "frozen",
      "supersededBy": "2021-07-01",